{
  "apiVersion": "platform.iac/v1",
  "kind": "InfrastructureRequest",
  "metadata": {
    "name": "example-reader-binding",
    "owner": "platform-sre",
    "application": "example-identity"
  },
  "spec": {
    "environment": "dev",
    "region": "eastus",
    "service": "iam-role-binding",
    "templateVersion": "v1",
    "parameters": {
      "principalId": "00000000-0000-0000-0000-000000000001",
      "principalType": "ServicePrincipal",
      "roleName": "Reader",
      "scopeResourceId": "/subscriptions/c12c3a36-99d8-4741-bcef-cd7df5d5cd4a/resourceGroups/example-rg"
    }
  }
}
