{
  "apiVersion": "platform.iac/v1",
  "kind": "InfrastructureRequest",
  "metadata": {
    "name": "example-vpn-gateway",
    "owner": "platform-sre",
    "application": "example-vpn"
  },
  "spec": {
    "environment": "dev",
    "region": "eastus",
    "service": "vpn-gateway",
    "templateVersion": "v1",
    "parameters": {
      "addressSpace": "10.252.0.0/16",
      "gatewaySubnetPrefix": "10.252.255.224/27",
      "sku": "VpnGw1",
      "bgpEnabled": false
    }
  }
}
