{
  "apiVersion": "platform.iac/v1",
  "kind": "InfrastructureRequest",
  "metadata": {
    "name": "platform-free-vnet",
    "owner": "platform-sre",
    "application": "iac-free-network-lab",
    "costCenter": "platform-lab"
  },
  "spec": {
    "environment": "dev",
    "region": "eastus",
    "service": "network",
    "templateVersion": "v1",
    "parameters": {
      "addressSpace": "10.251.0.0/16",
      "subnetName": "snet-app",
      "subnetPrefix": "10.251.1.0/24"
    }
  }
}
