{
  "apiVersion": "platform.iac/v1",
  "kind": "InfrastructureRequest",
  "metadata": {
    "name": "platform-free-managed-identity",
    "application": "iac-free-lab",
    "owner": "platform-sre",
    "costCenter": "platform-lab"
  },
  "spec": {
    "environment": "dev",
    "service": "managed-identity",
    "region": "eastus",
    "templateVersion": "v1",
    "parameters": {
      "purpose": "iac-e2e-validation"
    }
  }
}
