{
  "apiVersion": "platform.iac/v1",
  "kind": "InfrastructureRequest",
  "metadata": {"name": "payment-postgres", "owner": "payment-team", "application": "payment"},
  "spec": {
    "environment": "dev",
    "region": "eastus",
    "service": "postgresql-flexible",
    "templateVersion": "v1",
    "parameters": {"sku": "B_Standard_B2s", "storageMb": 32768}
  }
}
