{
  "apiVersion": "platform.iac/v1",
  "kind": "InfrastructureRequest",
  "metadata": {"name": "payment-redis", "owner": "payment-team", "application": "payment"},
  "spec": {
    "environment": "dev",
    "region": "eastus",
    "service": "managed-redis",
    "templateVersion": "v1",
    "parameters": {"sku": "Balanced_B1", "highAvailability": true}
  }
}
